{
  "schema_version": "1.0",
  "policy": "IL-9",
  "task": "Pit-HaulTruck-Ramp",
  "run_id": "20261007T120000Z-a2-il1",
  "checkpoint": {
    "id": "il1-checkpoint-1500",
    "path": "checkpoints/il1/model_1500.pt",
    "sha256": "f09312368852ea71b13122f1b98ecdeb8103bd264e6c56b145391d9f778fec80",
    "iteration": 1500
  },
  "observation_size": 63,
  "action_size": 2,
  "observation_layout_sha256": "a02b2ee3b344c58198d628da31c9efa9743d909eb2474c75d8dcdf5b41e9c75a",
  "task_config_sha256": "991e5b930fd9f8bfd9904b057b8860e4a9c3ba6d63c93f5fb3770bf0ab592f77",
  "normaliser": {
    "mean": [
      -0.2,
      0.15,
      -0.05,
      0.3,
      0.1,
      -0.1,
      0.25,
      0.05,
      -0.15,
      0.2,
      0.0,
      -0.2,
      0.15,
      -0.05,
      0.3,
      0.1,
      -0.1,
      0.25,
      0.05,
      -0.15,
      0.2,
      0.0,
      -0.2,
      0.15,
      -0.05,
      0.3,
      0.1,
      -0.1,
      0.25,
      0.05,
      -0.15,
      0.2,
      0.0,
      -0.2,
      0.15,
      -0.05,
      0.3,
      0.1,
      -0.1,
      0.25,
      0.05,
      -0.15,
      0.2,
      0.0,
      -0.2,
      0.15,
      -0.05,
      0.3,
      0.1,
      -0.1,
      0.25,
      0.05,
      -0.15,
      0.2,
      0.0,
      -0.2,
      0.15,
      -0.05,
      0.3,
      0.1,
      -0.1,
      0.25,
      0.05
    ],
    "var": [
      0.5,
      0.8,
      1.1,
      0.7,
      1.0,
      0.6,
      0.9,
      0.5,
      0.8,
      1.1,
      0.7,
      1.0,
      0.6,
      0.9,
      0.5,
      0.8,
      1.1,
      0.7,
      1.0,
      0.6,
      0.9,
      0.5,
      0.8,
      1.1,
      0.7,
      1.0,
      0.6,
      0.9,
      0.5,
      0.8,
      1.1,
      0.7,
      1.0,
      0.6,
      0.9,
      0.5,
      0.8,
      1.1,
      0.7,
      1.0,
      0.6,
      0.9,
      0.5,
      0.8,
      1.1,
      0.7,
      1.0,
      0.6,
      0.9,
      0.5,
      0.8,
      1.1,
      0.7,
      1.0,
      0.6,
      0.9,
      0.5,
      0.8,
      1.1,
      0.7,
      1.0,
      0.6,
      0.9
    ]
  },
  "actor": {
    "hidden_units": [
      256,
      256
    ],
    "activation": "elu"
  },
  "goldens": {
    "path": "goldens/il1-observations.npz",
    "sha256": "29b80c51e388d5981ca4fec71842ba408b00c644d68e128aeb429b9e6d856841",
    "count": 256
  }
}
